{
  "$schema": "https://json-schema.org/draft/2020-12/schema",
  "$id": "https://evozeus.org/schemas/product-channel-manifest.v1.json",
  "title": "EvoZeus Product Channel Manifest v1",
  "type": "object",
  "additionalProperties": false,
  "required": [
    "schema_version",
    "product_version",
    "channel",
    "generated_at",
    "components",
    "embedded",
    "compatibility"
  ],
  "properties": {
    "schema_version": {
      "const": "evozeus.product-channel.v2"
    },
    "product_version": {
      "type": "string",
      "pattern": "^v[0-9]+\\.[0-9]+\\.[0-9]+$"
    },
    "channel": {
      "enum": ["stable", "uat"]
    },
    "generated_at": {
      "type": "string",
      "format": "date-time"
    },
    "components": {
      "type": "object",
      "additionalProperties": false,
      "required": ["evozeus", "coevolve"],
      "properties": {
        "evozeus": {"$ref": "#/$defs/component"},
        "coevolve": {"$ref": "#/$defs/component"}
      }
    },
    "embedded": {
      "type": "object",
      "additionalProperties": false,
      "required": ["runtime", "session_signal"],
      "properties": {
        "runtime": {"$ref": "#/$defs/embeddedComponent"},
        "session_signal": {"$ref": "#/$defs/embeddedComponent"}
      }
    },
    "compatibility": {
      "type": "object",
      "additionalProperties": false,
      "required": ["runtime_min_inclusive", "runtime_max_exclusive", "coevolve_contract"],
      "properties": {
        "runtime_min_inclusive": {"type": "string", "pattern": "^v?[0-9]+\\.[0-9]+\\.[0-9]+$"},
        "runtime_max_exclusive": {"type": "string", "pattern": "^v?[0-9]+\\.[0-9]+\\.[0-9]+$"},
        "coevolve_contract": {"type": "string", "pattern": "^v[0-9]+\\.[0-9]+\\.[0-9]+$"}
      }
    }
  },
  "$defs": {
    "component": {
      "type": "object",
      "additionalProperties": false,
      "required": ["version", "commit", "source", "required_paths"],
      "properties": {
        "version": {"type": "string", "pattern": "^v[0-9]+\\.[0-9]+\\.[0-9]+$"},
        "commit": {"type": "string", "pattern": "^[a-f0-9]{40}$"},
        "source": {
          "type": "object",
          "additionalProperties": false,
          "required": ["kind", "url", "ref"],
          "properties": {
            "kind": {"enum": ["release_archive", "git"]},
            "url": {"type": "string", "format": "uri"},
            "ref": {"type": "string", "minLength": 1},
            "sha256": {"type": "string", "pattern": "^sha256:[a-f0-9]{64}$"}
          },
          "allOf": [
            {
              "if": {"properties": {"kind": {"const": "release_archive"}}},
              "then": {
                "properties": {"sha256": true},
                "required": ["sha256"]
              }
            }
          ]
        },
        "required_paths": {
          "type": "array",
          "minItems": 1,
          "uniqueItems": true,
          "items": {
            "type": "string",
            "minLength": 1,
            "pattern": "^(?!/)(?!.*(?:^|/)\\.\\.(?:/|$)).+$"
          }
        }
      }
    },
    "embeddedComponent": {
      "type": "object",
      "additionalProperties": false,
      "required": ["version", "path", "required_paths"],
      "properties": {
        "version": {"type": "string", "pattern": "^v[0-9]+\\.[0-9]+\\.[0-9]+$"},
        "path": {
          "type": "string",
          "minLength": 1,
          "pattern": "^(?!/)(?!.*(?:^|/)\\.\\.(?:/|$)).+$"
        },
        "required_paths": {
          "type": "array",
          "minItems": 1,
          "uniqueItems": true,
          "items": {
            "type": "string",
            "minLength": 1,
            "pattern": "^(?!/)(?!.*(?:^|/)\\.\\.(?:/|$)).+$"
          }
        }
      }
    }
  }
}
