{
  "schema_version": "evozeus.product-channel.v2",
  "product_version": "v0.4.0",
  "channel": "uat",
  "generated_at": "2026-07-30T15:26:11Z",
  "components": {
    "evozeus": {
      "version": "v0.4.0",
      "commit": "6e4d706feae53deafa8b0a111f2cb35ea669020f",
      "source": {
        "kind": "git",
        "url": "https://github.com/MetaInFLow/EvoZeus.git",
        "ref": "uat/current"
      },
      "required_paths": [
        "SKILL.md",
        ".codex-plugin/plugin.json",
        ".claude-plugin/plugin.json",
        ".claude-plugin/marketplace.json",
        "skills/using-evozeus/SKILL.md",
        "scripts/evozeus-cli.mjs",
        "scripts/evozeus-channels.mjs",
        "scripts/evozeus-hosts.mjs",
        "scripts/evozeus-launcher.mjs",
        "scripts/evozeus-coevolve-dispatcher.py",
        "docs/reference/user-visible-events.md",
        "schemas/product-channel-manifest.schema.json",
        "packages/runtime/src/evozeus_runtime/cli/main.py",
        "packs/session-signal/scripts/validate_official_factor_spec.py"
      ]
    },
    "coevolve": {
      "version": "v0.14.0",
      "commit": "c3065c2745a7e3771cb790919d41777f3a9cb8ad",
      "source": {
        "kind": "git",
        "url": "https://github.com/MetaInFLow/EvoZeus-CoEvolve.git",
        "ref": "v0.14.0"
      },
      "required_paths": [
        "SKILL.md",
        "scripts/evozeus_wrapper.py",
        "scripts/evozeus_notice.py",
        "templates/global/evozeus_wrapper_dispatcher.py",
        "templates/target/.evozeus_evoinfra/notice-policy.json",
        "contracts/v1/manifest.json"
      ]
    }
  },
  "embedded": {
    "runtime": {
      "version": "v0.2.0",
      "path": "packages/runtime",
      "required_paths": [
        "pyproject.toml",
        "src/evozeus_runtime/cli/main.py",
        "src/evozeus_runtime/ledger/paths.py"
      ]
    },
    "session_signal": {
      "version": "v0.1.0",
      "path": "packs/session-signal",
      "required_paths": [
        "SKILL.md",
        "scripts/validate_official_factor_spec.py",
        "factors/task-completion/spec.json"
      ]
    }
  },
  "compatibility": {
    "runtime_min_inclusive": "0.2.0",
    "runtime_max_exclusive": "0.3.0",
    "coevolve_contract": "v1.0.0"
  }
}
